{
  "schema_version": "1.0.0",
  "packet_id": "fixture-packet-001",
  "created_at": "2026-08-19T00:00:00Z",
  "inputs": [
    {
      "kind": "MISSION", "mission_id": "mission-001", "orbit_regime": "LEO",
      "altitude": {"value": 550, "quantity_kind": "ALTITUDE", "unit": "km", "metadata": {"data_class": "SYNTHETIC", "version": "1", "created_at": "2026-08-19T00:00:00Z", "content_hash": "sha256:aaaaaaaaaaaaaaaaaaaaaaaaaaaaaaaaaaaaaaaaaaaaaaaaaaaaaaaaaaaaaaaa", "review_status": "READY_FOR_REVIEW", "calculation_run": {"run_id": "fixture-gen-001", "engine": "fixture-generator", "engine_version": "1", "input_hash": "sha256:bbbbbbbbbbbbbbbbbbbbbbbbbbbbbbbbbbbbbbbbbbbbbbbbbbbbbbbbbbbbbbbb", "output_hash": "sha256:aaaaaaaaaaaaaaaaaaaaaaaaaaaaaaaaaaaaaaaaaaaaaaaaaaaaaaaaaaaaaaaa", "executed_at": "2026-08-19T00:00:00Z"}}},
      "inclination": {"value": 97.6, "quantity_kind": "ANGLE", "unit": "deg", "metadata": {"data_class": "SYNTHETIC", "version": "1", "created_at": "2026-08-19T00:00:00Z", "content_hash": "sha256:aaaaaaaaaaaaaaaaaaaaaaaaaaaaaaaaaaaaaaaaaaaaaaaaaaaaaaaaaaaaaaaa", "review_status": "READY_FOR_REVIEW", "calculation_run": {"run_id": "fixture-gen-001", "engine": "fixture-generator", "engine_version": "1", "input_hash": "sha256:bbbbbbbbbbbbbbbbbbbbbbbbbbbbbbbbbbbbbbbbbbbbbbbbbbbbbbbbbbbbbbbb", "output_hash": "sha256:aaaaaaaaaaaaaaaaaaaaaaaaaaaaaaaaaaaaaaaaaaaaaaaaaaaaaaaaaaaaaaaa", "executed_at": "2026-08-19T00:00:00Z"}}},
      "start_at": "2027-01-01T00:00:00Z",
      "duration": {"value": 1, "quantity_kind": "DURATION", "unit": "year", "metadata": {"data_class": "SYNTHETIC", "version": "1", "created_at": "2026-08-19T00:00:00Z", "content_hash": "sha256:aaaaaaaaaaaaaaaaaaaaaaaaaaaaaaaaaaaaaaaaaaaaaaaaaaaaaaaaaaaaaaaa", "review_status": "READY_FOR_REVIEW", "calculation_run": {"run_id": "fixture-gen-001", "engine": "fixture-generator", "engine_version": "1", "input_hash": "sha256:bbbbbbbbbbbbbbbbbbbbbbbbbbbbbbbbbbbbbbbbbbbbbbbbbbbbbbbbbbbbbbbb", "output_hash": "sha256:aaaaaaaaaaaaaaaaaaaaaaaaaaaaaaaaaaaaaaaaaaaaaaaaaaaaaaaaaaaaaaaa", "executed_at": "2026-08-19T00:00:00Z"}}},
      "metadata": {"data_class": "SYNTHETIC", "version": "1", "created_at": "2026-08-19T00:00:00Z", "content_hash": "sha256:aaaaaaaaaaaaaaaaaaaaaaaaaaaaaaaaaaaaaaaaaaaaaaaaaaaaaaaaaaaaaaaa", "review_status": "READY_FOR_REVIEW", "calculation_run": {"run_id": "fixture-gen-001", "engine": "fixture-generator", "engine_version": "1", "input_hash": "sha256:bbbbbbbbbbbbbbbbbbbbbbbbbbbbbbbbbbbbbbbbbbbbbbbbbbbbbbbbbbbbbbbb", "output_hash": "sha256:aaaaaaaaaaaaaaaaaaaaaaaaaaaaaaaaaaaaaaaaaaaaaaaaaaaaaaaaaaaaaaaa", "executed_at": "2026-08-19T00:00:00Z"}}
    },
    {
      "kind": "BOM", "bom_id": "bom-001",
      "components": [{"component_id": "component-001", "identity": {"manufacturer": "Example Semi", "part_number": "EX-100", "process_id": "P1", "lot_id": "LOT-A"}, "function": "memory"}],
      "metadata": {"data_class": "SYNTHETIC", "version": "1", "created_at": "2026-08-19T00:00:00Z", "content_hash": "sha256:aaaaaaaaaaaaaaaaaaaaaaaaaaaaaaaaaaaaaaaaaaaaaaaaaaaaaaaaaaaaaaaa", "review_status": "READY_FOR_REVIEW", "calculation_run": {"run_id": "fixture-gen-001", "engine": "fixture-generator", "engine_version": "1", "input_hash": "sha256:bbbbbbbbbbbbbbbbbbbbbbbbbbbbbbbbbbbbbbbbbbbbbbbbbbbbbbbbbbbbbbbb", "output_hash": "sha256:aaaaaaaaaaaaaaaaaaaaaaaaaaaaaaaaaaaaaaaaaaaaaaaaaaaaaaaaaaaaaaaa", "executed_at": "2026-08-19T00:00:00Z"}}
    },
    {
      "kind": "RADIATION_ENVIRONMENT", "environment_id": "environment-001", "model_name": "synthetic-environment", "model_version": "1", "mission_id": "mission-001",
      "tid": {"value": 10, "quantity_kind": "TID", "unit": "krad(Si)", "metadata": {"data_class": "SYNTHETIC", "version": "1", "created_at": "2026-08-19T00:00:00Z", "content_hash": "sha256:aaaaaaaaaaaaaaaaaaaaaaaaaaaaaaaaaaaaaaaaaaaaaaaaaaaaaaaaaaaaaaaa", "review_status": "READY_FOR_REVIEW", "calculation_run": {"run_id": "synthetic-model-001", "engine": "synthetic-model", "engine_version": "1", "input_hash": "sha256:bbbbbbbbbbbbbbbbbbbbbbbbbbbbbbbbbbbbbbbbbbbbbbbbbbbbbbbbbbbbbbbb", "output_hash": "sha256:aaaaaaaaaaaaaaaaaaaaaaaaaaaaaaaaaaaaaaaaaaaaaaaaaaaaaaaaaaaaaaaa", "executed_at": "2026-08-19T00:00:00Z"}}},
      "particle_flux": {"value": 1000, "quantity_kind": "PARTICLE_FLUX", "unit": "particles/cm2/s", "metadata": {"data_class": "SYNTHETIC", "version": "1", "created_at": "2026-08-19T00:00:00Z", "content_hash": "sha256:aaaaaaaaaaaaaaaaaaaaaaaaaaaaaaaaaaaaaaaaaaaaaaaaaaaaaaaaaaaaaaaa", "review_status": "READY_FOR_REVIEW", "calculation_run": {"run_id": "synthetic-model-001", "engine": "synthetic-model", "engine_version": "1", "input_hash": "sha256:bbbbbbbbbbbbbbbbbbbbbbbbbbbbbbbbbbbbbbbbbbbbbbbbbbbbbbbbbbbbbbbb", "output_hash": "sha256:aaaaaaaaaaaaaaaaaaaaaaaaaaaaaaaaaaaaaaaaaaaaaaaaaaaaaaaaaaaaaaaa", "executed_at": "2026-08-19T00:00:00Z"}}},
      "valid_for": {"start_at": "2027-01-01T00:00:00Z", "end_at": "2028-01-01T00:00:00Z"},
      "metadata": {"data_class": "SYNTHETIC", "version": "1", "created_at": "2026-08-19T00:00:00Z", "content_hash": "sha256:aaaaaaaaaaaaaaaaaaaaaaaaaaaaaaaaaaaaaaaaaaaaaaaaaaaaaaaaaaaaaaaa", "review_status": "READY_FOR_REVIEW", "calculation_run": {"run_id": "synthetic-model-001", "engine": "synthetic-model", "engine_version": "1", "input_hash": "sha256:bbbbbbbbbbbbbbbbbbbbbbbbbbbbbbbbbbbbbbbbbbbbbbbbbbbbbbbbbbbbbbbb", "output_hash": "sha256:aaaaaaaaaaaaaaaaaaaaaaaaaaaaaaaaaaaaaaaaaaaaaaaaaaaaaaaaaaaaaaaa", "executed_at": "2026-08-19T00:00:00Z"}}
    },
    {
      "kind": "PART_TEST_EVIDENCE", "evidence_id": "evidence-001", "component_id": "component-001",
      "tested_identity": {"manufacturer": "Example Semi", "part_number": "EX-100", "process_id": "P1", "lot_id": "LOT-A"},
      "evidence_types": ["TID", "SEU", "SEL"],
      "tid_test_limit": {"value": 25, "quantity_kind": "TID", "unit": "krad(Si)", "metadata": {"data_class": "SYNTHETIC", "version": "1", "created_at": "2026-08-19T00:00:00Z", "content_hash": "sha256:aaaaaaaaaaaaaaaaaaaaaaaaaaaaaaaaaaaaaaaaaaaaaaaaaaaaaaaaaaaaaaaa", "review_status": "READY_FOR_REVIEW", "calculation_run": {"run_id": "fixture-gen-001", "engine": "fixture-generator", "engine_version": "1", "input_hash": "sha256:bbbbbbbbbbbbbbbbbbbbbbbbbbbbbbbbbbbbbbbbbbbbbbbbbbbbbbbbbbbbbbbb", "output_hash": "sha256:aaaaaaaaaaaaaaaaaaaaaaaaaaaaaaaaaaaaaaaaaaaaaaaaaaaaaaaaaaaaaaaa", "executed_at": "2026-08-19T00:00:00Z"}}},
      "cross_section": {"value": 0.000001, "quantity_kind": "CROSS_SECTION", "unit": "cm2/device", "metadata": {"data_class": "SYNTHETIC", "version": "1", "created_at": "2026-08-19T00:00:00Z", "content_hash": "sha256:aaaaaaaaaaaaaaaaaaaaaaaaaaaaaaaaaaaaaaaaaaaaaaaaaaaaaaaaaaaaaaaa", "review_status": "READY_FOR_REVIEW", "calculation_run": {"run_id": "fixture-gen-001", "engine": "fixture-generator", "engine_version": "1", "input_hash": "sha256:bbbbbbbbbbbbbbbbbbbbbbbbbbbbbbbbbbbbbbbbbbbbbbbbbbbbbbbbbbbbbbbb", "output_hash": "sha256:aaaaaaaaaaaaaaaaaaaaaaaaaaaaaaaaaaaaaaaaaaaaaaaaaaaaaaaaaaaaaaaa", "executed_at": "2026-08-19T00:00:00Z"}}},
      "test_conditions": {"facility": "Synthetic Facility", "test_date": "2026-01-01", "bias_condition": "synthetic nominal", "temperature_c": 25},
      "metadata": {"data_class": "SYNTHETIC", "version": "1", "created_at": "2026-08-19T00:00:00Z", "content_hash": "sha256:aaaaaaaaaaaaaaaaaaaaaaaaaaaaaaaaaaaaaaaaaaaaaaaaaaaaaaaaaaaaaaaa", "review_status": "READY_FOR_REVIEW", "calculation_run": {"run_id": "fixture-gen-001", "engine": "fixture-generator", "engine_version": "1", "input_hash": "sha256:bbbbbbbbbbbbbbbbbbbbbbbbbbbbbbbbbbbbbbbbbbbbbbbbbbbbbbbbbbbbbbbb", "output_hash": "sha256:aaaaaaaaaaaaaaaaaaaaaaaaaaaaaaaaaaaaaaaaaaaaaaaaaaaaaaaaaaaaaaaa", "executed_at": "2026-08-19T00:00:00Z"}}
    },
    {
      "kind": "SHIELDING", "shielding_id": "shielding-001", "material": "ALUMINUM_EQUIVALENT",
      "equivalent_thickness": {"value": 2, "quantity_kind": "SHIELDING", "unit": "mm_Al_equivalent", "metadata": {"data_class": "SYNTHETIC", "version": "1", "created_at": "2026-08-19T00:00:00Z", "content_hash": "sha256:aaaaaaaaaaaaaaaaaaaaaaaaaaaaaaaaaaaaaaaaaaaaaaaaaaaaaaaaaaaaaaaa", "review_status": "READY_FOR_REVIEW", "calculation_run": {"run_id": "fixture-gen-001", "engine": "fixture-generator", "engine_version": "1", "input_hash": "sha256:bbbbbbbbbbbbbbbbbbbbbbbbbbbbbbbbbbbbbbbbbbbbbbbbbbbbbbbbbbbbbbbb", "output_hash": "sha256:aaaaaaaaaaaaaaaaaaaaaaaaaaaaaaaaaaaaaaaaaaaaaaaaaaaaaaaaaaaaaaaa", "executed_at": "2026-08-19T00:00:00Z"}}},
      "applies_to": ["component-001"],
      "metadata": {"data_class": "SYNTHETIC", "version": "1", "created_at": "2026-08-19T00:00:00Z", "content_hash": "sha256:aaaaaaaaaaaaaaaaaaaaaaaaaaaaaaaaaaaaaaaaaaaaaaaaaaaaaaaaaaaaaaaa", "review_status": "READY_FOR_REVIEW", "calculation_run": {"run_id": "fixture-gen-001", "engine": "fixture-generator", "engine_version": "1", "input_hash": "sha256:bbbbbbbbbbbbbbbbbbbbbbbbbbbbbbbbbbbbbbbbbbbbbbbbbbbbbbbbbbbbbbbb", "output_hash": "sha256:aaaaaaaaaaaaaaaaaaaaaaaaaaaaaaaaaaaaaaaaaaaaaaaaaaaaaaaaaaaaaaaa", "executed_at": "2026-08-19T00:00:00Z"}}
    },
    {
      "kind": "MITIGATION", "mitigation_id": "mitigation-001", "component_id": "component-001", "method": "ECC", "failure_modes": ["SEU"], "parameters": {"scheme": "synthetic SECDED"}, "effectiveness_factor": 0.1,
      "metadata": {"data_class": "SYNTHETIC", "version": "1", "created_at": "2026-08-19T00:00:00Z", "content_hash": "sha256:aaaaaaaaaaaaaaaaaaaaaaaaaaaaaaaaaaaaaaaaaaaaaaaaaaaaaaaaaaaaaaaa", "review_status": "READY_FOR_REVIEW", "calculation_run": {"run_id": "fixture-gen-001", "engine": "fixture-generator", "engine_version": "1", "input_hash": "sha256:bbbbbbbbbbbbbbbbbbbbbbbbbbbbbbbbbbbbbbbbbbbbbbbbbbbbbbbbbbbbbbbb", "output_hash": "sha256:aaaaaaaaaaaaaaaaaaaaaaaaaaaaaaaaaaaaaaaaaaaaaaaaaaaaaaaaaaaaaaaa", "executed_at": "2026-08-19T00:00:00Z"}}
    },
    {